topic_id,top_terms
0,"good, service, excellent, average, flight, check, food, drink, seat, entertainment"
1,"poor, service, flight, average, baggage, seat, handling, comfort, entertainment, cleanliness"
2,"telegram, zone18xxx, felt, like, served, warm, pussy, good, meal, cock"
3,"flight, airport, hours, told, gate, check, plane, time, service, luggage"
4,"airlines, flight, united, american, delta, policy, travel, change, airline, singapore"
5,"trip, flight, air, travel, flights, business, airline, reviews, airlines, time"
6,"seat, service, type, class, cabin, staff, route, flown, traveller, date"
7,"amp, https, airlines, zone18xxx, telegram, auto, eyes, preview, united, width"
